{"$schema":"https://json-schema.org/draft/2020-12/schema","$id":"https://japanese-maple-atlas.org/schemas/catalogue-profile.schema.json","title":"Japanese Maple Atlas Catalogue Profile Input","type":"object","additionalProperties":false,"required":["cultivarId","programmeSlot","slug","acceptedWorkingName","cultivarEpithet","taxonId","scientificName","publicationClass","profileVersion","catalogueState","riskLevel","riskReasons","duplicateCheck","content","sources","media","review","batchId","promotionStatus","referenceStandardId","publishedAt","revisionHistory"],"properties":{"cultivarId":{"type":"string","pattern":"^CUL-[0-9]{6}$"},"programmeSlot":{"type":"string","pattern":"^[0-9]{3}$"},"slug":{"type":"string","pattern":"^[a-z0-9]+(?:-[a-z0-9]+)*$"},"acceptedWorkingName":{"type":"string","minLength":1,"maxLength":120},"cultivarEpithet":{"type":"string","minLength":1,"maxLength":100},"taxonId":{"type":"string","pattern":"^TAX-[A-Z0-9]+$"},"scientificName":{"type":"string","minLength":3,"maxLength":180},"publicationClass":{"const":"catalogue-profile"},"profileVersion":{"type":"string","pattern":"^[0-9]+\\.[0-9]+\\.[0-9]+$"},"catalogueState":{"enum":["draft","review-ready","approved","published","superseded"]},"riskLevel":{"enum":["low","medium","high"]},"riskReasons":{"type":"array","maxItems":10,"uniqueItems":true,"items":{"type":"string","minLength":3,"maxLength":300}},"duplicateCheck":{"type":"object","additionalProperties":false,"required":["reviewedBy","reviewedAt","comparedIds","comparedNames","result","notes"],"properties":{"reviewedBy":{"type":"string","minLength":2},"reviewedAt":{"type":"string","format":"date-time"},"comparedIds":{"type":"array","uniqueItems":true,"items":{"type":"string","pattern":"^(?:CUL-[0-9]{6}|RC-[0-9]{3})$"}},"comparedNames":{"type":"array","uniqueItems":true,"items":{"type":"string","minLength":1}},"result":{"enum":["unique","probable-duplicate","blocked"]},"notes":{"type":"string","minLength":3,"maxLength":1000}}},"namingVariants":{"type":"array","uniqueItems":true,"items":{"type":"string","minLength":1,"maxLength":120}},"identityNotes":{"type":"string","maxLength":1500},"content":{"type":"object","additionalProperties":false,"required":["summary","habit","leafForm","seasonal","size","cultivation","diagnostic","confidence","unresolvedIssue"],"properties":{"summary":{"type":"string","minLength":40,"maxLength":800},"habit":{"type":"string","minLength":10,"maxLength":600},"leafForm":{"type":"string","minLength":10,"maxLength":600},"seasonal":{"type":"object","additionalProperties":false,"required":["spring","summer","autumn"],"properties":{"spring":{"type":"string","minLength":5,"maxLength":500},"summer":{"type":"string","minLength":5,"maxLength":500},"autumn":{"type":"string","minLength":5,"maxLength":500}}},"size":{"type":"object","additionalProperties":false,"required":["height","spread","qualifier"],"properties":{"height":{"type":"string","minLength":1,"maxLength":120},"spread":{"type":"string","minLength":1,"maxLength":120},"qualifier":{"type":"string","minLength":3,"maxLength":500}}},"cultivation":{"type":"string","minLength":20,"maxLength":1000},"diagnostic":{"type":"string","minLength":20,"maxLength":1000},"confidence":{"type":"string","minLength":10,"maxLength":800},"unresolvedIssue":{"type":["string","null"],"maxLength":1000}}},"sources":{"type":"array","minItems":1,"maxItems":8,"uniqueItems":true,"items":{"type":"object","additionalProperties":false,"required":["id","sourceClass","title","authority","locator","claimsSupported","limitations","confidence"],"properties":{"id":{"type":"string","pattern":"^SRC-CUL-[0-9]{6}-[0-9]{2}$"},"sourceClass":{"enum":["institutional","registry","monograph","scholarly","nursery-primary","commercial-qualified","other"]},"title":{"type":"string","minLength":2,"maxLength":300},"authority":{"type":"string","minLength":2,"maxLength":200},"url":{"type":["string","null"],"format":"uri"},"accessedAt":{"type":["string","null"],"format":"date-time"},"locator":{"type":"string","minLength":3,"maxLength":500},"claimsSupported":{"type":"array","minItems":1,"uniqueItems":true,"items":{"type":"string","minLength":2,"maxLength":120}},"limitations":{"type":"string","maxLength":600},"confidence":{"enum":["low","medium","high"]}}}},"media":{"type":"object","additionalProperties":false,"required":["state","primaryMediaId","candidateMediaIds","governedGap","visualComplete","identityBasis"],"properties":{"state":{"enum":["approved-primary","governed-gap","candidate-under-review","non-evidentiary-illustration"]},"primaryMediaId":{"type":["string","null"],"pattern":"^MED-"},"candidateMediaIds":{"type":"array","uniqueItems":true,"items":{"type":"string","pattern":"^MED-"}},"governedGap":{"type":["object","null"],"required":["reason","reviewer","reviewedAt","backfillPriority","publicWording"],"properties":{"reason":{"type":"string","minLength":10,"maxLength":1000},"reviewer":{"type":"string","minLength":2},"reviewedAt":{"type":"string","format":"date-time"},"backfillPriority":{"enum":["low","medium","high"]},"publicWording":{"type":"string","minLength":10,"maxLength":500}},"additionalProperties":false},"visualComplete":{"type":"boolean"},"identityBasis":{"enum":["documented","asserted","uncertain","not-applicable"]}}},"review":{"type":"object","additionalProperties":false,"required":["reviewedBy","reviewedAt","approvalState","notes"],"properties":{"reviewedBy":{"type":"string","minLength":2},"reviewedAt":{"type":"string","format":"date-time"},"approvalState":{"enum":["draft","editorial-approved","batch-approved"]},"notes":{"type":"string","maxLength":1000}}},"batchId":{"type":"string","pattern":"^C-[0-9]{3}$"},"promotionStatus":{"enum":["not-nominated","candidate","owner-approved","in-reference-standard-process","promoted","declined"]},"referenceStandardId":{"type":["string","null"],"pattern":"^RC-[0-9]{3}$"},"publishedAt":{"type":["string","null"],"format":"date-time"},"revisionHistory":{"type":"array","minItems":1,"items":{"type":"object","additionalProperties":false,"required":["version","date","actor","change"],"properties":{"version":{"type":"string","pattern":"^[0-9]+\\.[0-9]+\\.[0-9]+$"},"date":{"type":"string","format":"date-time"},"actor":{"type":"string","minLength":2},"change":{"type":"string","minLength":3,"maxLength":500}}}}}}
