{
  "cultivarId": "CUL-000011",
  "programmeSlot": "011",
  "slug": "orange-dream",
  "acceptedWorkingName": "Orange Dream",
  "cultivarEpithet": "Orange Dream",
  "taxonId": "TAX-APAL",
  "scientificName": "Acer palmatum ‘Orange Dream’",
  "publicationClass": "catalogue-profile",
  "profileVersion": "1.2.0",
  "catalogueState": "published",
  "riskLevel": "low",
  "riskReasons": [
    "The accepted name and supported taxon are consistent across the reviewed institutional sources.",
    "Seasonal colour descriptions are compatible but intensity and timing remain site-dependent.",
    "No material synonym, commercial-renaming or core-morphology conflict was found."
  ],
  "duplicateCheck": {
    "reviewedBy": "Japanese Maple Atlas editorial stream",
    "reviewedAt": "2026-07-28T23:30:00Z",
    "comparedIds": [
      "RC-001",
      "RC-002",
      "RC-003",
      "RC-004",
      "RC-005",
      "RC-006",
      "RC-007",
      "RC-008",
      "RC-009",
      "RC-010",
      "CUL-000012",
      "CUL-000013",
      "CUL-000014",
      "CUL-000015",
      "CUL-000016",
      "CUL-000017",
      "CUL-000018",
      "CUL-000019",
      "CUL-000020",
      "CUL-000021",
      "CUL-000022",
      "CUL-000023",
      "CUL-000024",
      "CUL-000025"
    ],
    "comparedNames": [
      "Bloodgood",
      "Seiryu",
      "Sango-kaku",
      "Crimson Queen",
      "Aureum",
      "Osakazuki",
      "Butterfly",
      "Shishi-gashira",
      "Katsura",
      "Mikawa-yatsubusa",
      "Koto-no-ito",
      "Inaba-shidare",
      "Beni-kawa",
      "Trompenburg",
      "Autumn Moon",
      "Waterfall",
      "Aoyagi",
      "Shin-deshōjō",
      "Red Dragon",
      "Tamukeyama",
      "Orangeola",
      "Higasa-yama",
      "Arakawa",
      "Red Pygmy",
      "Orange dream"
    ],
    "result": "unique",
    "notes": "Compared with all Reference Standards RC-001–RC-010 and all other owner-approved Catalogue assignments CUL-000012–CUL-000025. It is distinct from RC-009 ‘Katsura’ by its governed seasonal sequence and from RC-005 ‘Aureum’ by taxon, leaf expression and overall profile. No probable duplicate remains."
  },
  "namingVariants": [],
  "identityNotes": "The accepted working name follows the RHS accepted plant profile and the approved identity registry. No synonym is approved. The profile describes a named cultivar but does not authenticate individual plants from colour or habit alone.",
  "content": {
    "summary": "A medium-sized, bushy Japanese maple selected for a bright seasonal sequence: yellow to yellow-orange spring foliage, greener summer leaves and orange-yellow autumn colour, with bright green bark adding secondary interest.",
    "habit": "Bushy, rounded deciduous shrub or small tree, commonly described around 3 m in garden conditions; architecture and final scale depend on age, site, training and rootstock.",
    "leafForm": "Palmate leaves in the ordinary palmatum horticultural group rather than a dissected or linearilobum form; the principal Catalogue value is seasonal colour rather than a uniquely diagnostic leaf outline.",
    "seasonal": {
      "spring": "Leaves open yellow, with an orange to orange-red edge reported by NC State; exact saturation varies with exposure and observation date.",
      "summer": "Foliage becomes greenish to lime green rather than remaining uniformly yellow.",
      "autumn": "Leaves turn orange-yellow, sometimes with stronger orange expression under favourable seasonal conditions."
    },
    "size": {
      "height": "2.5–4 m",
      "spread": "2.5–4 m",
      "qualifier": "RHS published range with a stated 10–20-year time to maturity; use as an approximate garden range, not a fixed maximum."
    },
    "cultivation": "Grow in moist but well-drained soil in a sheltered position, in full sun to partial shade. Reliable moisture and protection from excessive exposure reduce scorch risk; partial shade is useful where summers are hot or drying.",
    "diagnostic": "Compare with RC-009 ‘Katsura’, whose spring-emergence profile is a different chartreuse and yellow-orange trajectory, and with RC-005 ‘Aureum’, which belongs to Acer shirasawanum and has a different leaf and taxon profile. Colour resemblance alone does not authenticate ‘Orange Dream’.",
    "confidence": "High confidence in the accepted name, taxon and broad seasonal sequence; moderate confidence in exact colour intensity and mature dimensions because these vary by source framework, site and age.",
    "unresolvedIssue": "The lean review did not establish a primary origin history or quantify how consistently the orange-red spring margin appears across climates; neither gap creates a material identity conflict."
  },
  "sources": [
    {
      "id": "SRC-CUL-000011-01",
      "sourceClass": "institutional",
      "title": "Acer palmatum 'Orange Dream' (P) — plant profile",
      "authority": "Royal Horticultural Society",
      "url": "https://www.rhs.org.uk/plants/60709/acer-palmatum-orange-dream-p/details",
      "accessedAt": "2026-07-28T23:30:00Z",
      "locator": "Plant profile sections: description, size, botanical details, cultivation, hardiness and propagation.",
      "claimsSupported": [
        "identity",
        "name status",
        "habit",
        "seasonality",
        "size",
        "cultivation",
        "hardiness",
        "propagation"
      ],
      "limitations": "UK-centred horticultural framework; profile description is not a clonal-authentication record.",
      "confidence": "high"
    },
    {
      "id": "SRC-CUL-000011-02",
      "sourceClass": "institutional",
      "title": "Acer palmatum 'Orange Dream' (P) — herbarium specimen WSY0167332",
      "authority": "RHS Digital Collections",
      "url": "https://collections.rhs.org.uk/view/160427/acer-palmatum-orange-dream-p",
      "accessedAt": "2026-07-28T23:30:00Z",
      "locator": "Herbarium record WSY0167332; collected 22 November 2021 in Surrey, United Kingdom.",
      "claimsSupported": [
        "documented name use",
        "specimen record",
        "collection date"
      ],
      "limitations": "Single herbarium record; does not establish cultivar origin, commercial uniformity or full seasonal performance.",
      "confidence": "high"
    },
    {
      "id": "SRC-CUL-000011-03",
      "sourceClass": "institutional",
      "title": "Japanese Maple — Acer palmatum cultivar list",
      "authority": "North Carolina Extension Gardener Plant Toolbox",
      "url": "https://plants.ces.ncsu.edu/plants/acer-palmatum/common-name/japanese-maple/",
      "accessedAt": "2026-07-28T23:30:00Z",
      "locator": "Cultivars/varieties entry for 'Orange Dream' plus species-level cultivation and morphology sections.",
      "claimsSupported": [
        "supported taxon",
        "cultivar listing",
        "spring colour",
        "compact habit",
        "general cultivation"
      ],
      "limitations": "Cultivar treatment is brief and embedded in a species page; dimensions and detailed identity history are not supplied.",
      "confidence": "medium"
    }
  ],
  "media": {
    "state": "approved-primary",
    "primaryMediaId": "MED-CUL-000011-001",
    "candidateMediaIds": [
      "MED-CUL-000011-002",
      "MED-CUL-000011-003"
    ],
    "governedGap": null,
    "visualComplete": true,
    "identityBasis": "asserted"
  },
  "review": {
    "reviewedBy": "Project Owner and CTO / engineering",
    "reviewedAt": "2026-07-29T02:20:00Z",
    "approvalState": "batch-approved",
    "notes": "C0 and C1 passed. The Project Owner approved temporary governed gap MVG-CUL-000011-001 with high-priority backfill and a 30 September 2026 review. C3 publication remains subject to the protected workflow and production inspection."
  },
  "batchId": "C-001",
  "promotionStatus": "not-nominated",
  "referenceStandardId": null,
  "publishedAt": "2026-07-29T02:20:00Z",
  "revisionHistory": [
    {
      "version": "1.0.0",
      "date": "2026-07-28T23:30:00Z",
      "actor": "Japanese Maple Atlas editorial stream",
      "change": "Created the canonical non-public Catalogue Profile input; completed C0 duplicate/naming review and C1 editorial/source review."
    },
    {
      "version": "1.1.0",
      "date": "2026-07-29T02:20:00Z",
      "actor": "Project Owner and CTO / engineering",
      "change": "Approved temporary governed visual gap MVG-CUL-000011-001, batch-approved the low-risk profile and initiated C3 publication for Catalogue Batch C-001."
    },
    {
      "version": "1.2.0",
      "date": "2026-07-29T07:30:00Z",
      "actor": "Japanese Maple Atlas media / visual-assets stream",
      "change": "Replaced the temporary governed visual gap with a validated three-item Visual-First gallery using lawful, attributed and identity-qualified external photographs."
    }
  ]
}
