{
  "cultivarId": "CUL-000012",
  "programmeSlot": "012",
  "slug": "koto-no-ito",
  "acceptedWorkingName": "Koto-no-ito",
  "cultivarEpithet": "Koto-no-ito",
  "taxonId": "TAX-APAL",
  "scientificName": "Acer palmatum ‘Koto-no-ito’",
  "publicationClass": "catalogue-profile",
  "profileVersion": "1.1.0",
  "catalogueState": "published",
  "riskLevel": "low",
  "riskReasons": [
    "The accepted hyphenated name and Acer palmatum placement are supported.",
    "The characteristic narrow-lobed linearilobum foliage is consistent across the reviewed sources.",
    "Near-name cultivars and an informal nickname require explicit separation but do not create an identity dispute."
  ],
  "duplicateCheck": {
    "reviewedBy": "Japanese Maple Atlas editorial stream",
    "reviewedAt": "2026-07-28T23:30:00Z",
    "comparedIds": ["RC-001","RC-002","RC-003","RC-004","RC-005","RC-006","RC-007","RC-008","RC-009","RC-010","CUL-000011","CUL-000013","CUL-000014","CUL-000015","CUL-000016","CUL-000017","CUL-000018","CUL-000019","CUL-000020","CUL-000021","CUL-000022","CUL-000023","CUL-000024","CUL-000025"],
    "comparedNames": ["Bloodgood","Seiryu","Sango-kaku","Crimson Queen","Aureum","Osakazuki","Butterfly","Shishi-gashira","Katsura","Mikawa-yatsubusa","Orange Dream","Inaba-shidare","Beni-kawa","Trompenburg","Autumn Moon","Waterfall","Aoyagi","Shin-deshōjō","Red Dragon","Tamukeyama","Orangeola","Higasa-yama","Arakawa","Red Pygmy","Yamato-koto-no-ito","Koto-ito-komachi","Dancing Monkey Tree"],
    "result": "unique",
    "notes": "Compared with all RC-001–RC-010 records and all other approved Catalogue assignments. It is not RC-002 ‘Seiryu’: ‘Koto-no-ito’ has linearilobum strap-like lobes rather than an upright dissectum leaf. ‘Yamato-koto-no-ito’ and ‘Koto-ito-komachi’ remain separate near-name cultivars. C0 resolves as unique."
  },
  "namingVariants": ["Koto no ito","Koto-no-Ito"],
  "identityNotes": "The Atlas uses the RHS accepted hyphenated form ‘Koto-no-ito’. Spaced and title-case forms are retained only as search variants. ‘Yamato-koto-no-ito’ and ‘Koto-ito-komachi’ are separate near-names, not synonyms. The Seattle Japanese Garden nickname ‘Dancing Monkey Tree’ is not treated as a cultivar synonym.",
  "content": {
    "summary": "A slow-growing, rounded Japanese maple valued for exceptionally narrow, thread-like green leaf lobes that move lightly in the wind and turn orange-yellow in autumn.",
    "habit": "Rounded, bushy, semi-dwarf shrub or small tree with graceful branching; RHS places the usual mature range around 1.5–2.5 m, while descriptive text allows development toward about 3 m over time.",
    "leafForm": "Linearilobum foliage with five to seven long, narrow, tapering lobes. A Seattle Japanese Garden account notes very fine spring leaves on older wood and somewhat broader, though still narrow, leaves on later new growth.",
    "seasonal": {"spring":"Narrow leaves emerge green with possible crimson tints, especially on the fresh flush.","summer":"Foliage settles to bright or medium green; later growth may carry slightly broader narrow lobes.","autumn":"Leaves commonly turn orange-yellow."},
    "size": {"height":"1.5–2.5 m","spread":"1.5–2.5 m","qualifier":"RHS published range with a 20–50-year time to maturity; descriptive text notes eventual development toward about 3 m."},
    "cultivation": "Use moisture-retentive but well-drained soil in a sheltered site, with full sun to partial shade according to climate. Partial shade and consistent moisture help protect the narrow foliage from scorch; container plants require attentive watering.",
    "diagnostic": "The defining comparison trait is linearilobum foliage: long strap-like lobes rather than the finely dissected laceleaf structure of RC-002 ‘Seiryu’ or RC-004 ‘Crimson Queen’. Near-names must not be merged on typography alone.",
    "confidence": "High confidence in accepted name, taxon, leaf-form class and broad seasonal sequence; moderate confidence in the degree of leaf-width change between early and later growth because it is based on a living-collection account rather than a standardized multi-accession study.",
    "unresolvedIssue": "The informal English nickname and the quantitative extent of early-versus-late leaf dimorphism were not investigated beyond the cited living-collection account."
  },
  "sources": [
    {"id":"SRC-CUL-000012-01","sourceClass":"institutional","title":"Acer palmatum 'Koto-no-ito' (L) — plant profile","authority":"Royal Horticultural Society","url":"https://www.rhs.org.uk/plants/48739/acer-palmatum-koto-no-ito-l/details","accessedAt":"2026-07-28T23:30:00Z","locator":"Plant profile sections: accepted name, description, linearilobum classification, size, cultivation and propagation.","claimsSupported":["identity","name status","habit","leaf form","seasonality","size","cultivation","hardiness"],"limitations":"UK-centred horticultural framework; no primary origin or standardized multi-accession measurements.","confidence":"high"},
    {"id":"SRC-CUL-000012-02","sourceClass":"institutional","title":"In Bloom: Koto no Ito","authority":"Seattle Japanese Garden","url":"https://www.seattlejapanesegarden.org/blog/2015/10/08/in-bloom-koto-no-ito","accessedAt":"2026-07-28T23:30:00Z","locator":"Living-collection article describing two garden specimens, linearilobum foliage, leaf-form change and seasonal colour.","claimsSupported":["living collection","leaf form","spring colour","summer colour","informal nickname"],"limitations":"Interpretive garden article rather than a formal registry or monograph; observations concern the garden's specimens.","confidence":"medium"},
    {"id":"SRC-CUL-000012-03","sourceClass":"institutional","title":"Japanese Maple — Acer palmatum cultivar list","authority":"North Carolina Extension Gardener Plant Toolbox","url":"https://plants.ces.ncsu.edu/plants/acer-palmatum/common-name/japanese-maple/","accessedAt":"2026-07-28T23:30:00Z","locator":"Cultivars/varieties entry for 'Koto no ito' plus species-level cultivation guidance.","claimsSupported":["supported taxon","spaced naming variant","thread-like foliage","general cultivation"],"limitations":"Cultivar entry is concise and does not resolve near-name history or dimensions.","confidence":"medium"}
  ],
  "media": {
    "state": "governed-gap",
    "primaryMediaId": null,
    "candidateMediaIds": [],
    "governedGap": {
      "reason": "MVG-CUL-000012-001 approved temporarily: cultivar-specific institutional images were identified, but Atlas republication rights, original delivery and specimen mapping remain unresolved.",
      "reviewer": "Project Owner",
      "reviewedAt": "2026-07-29T02:20:00Z",
      "backfillPriority": "high",
      "publicWording": "No approved cultivar-specific image is currently available. The Atlas has recorded this as a governed visual gap and will add an image after rights, provenance and identity review."
    },
    "visualComplete": false,
    "identityBasis": "asserted"
  },
  "review": {
    "reviewedBy": "Project Owner and CTO / engineering",
    "reviewedAt": "2026-07-29T02:20:00Z",
    "approvalState": "batch-approved",
    "notes": "C0 and C1 passed. The Project Owner approved temporary governed gap MVG-CUL-000012-001 with high-priority backfill and a 30 September 2026 review. C3 publication remains subject to the protected workflow and production inspection."
  },
  "batchId": "C-001",
  "promotionStatus": "not-nominated",
  "referenceStandardId": null,
  "publishedAt": "2026-07-29T02:20:00Z",
  "revisionHistory": [
    {"version":"1.0.0","date":"2026-07-28T23:30:00Z","actor":"Japanese Maple Atlas editorial stream","change":"Created the canonical non-public Catalogue Profile input; completed C0 duplicate/naming review and C1 editorial/source review."},
    {"version":"1.1.0","date":"2026-07-29T02:20:00Z","actor":"Project Owner and CTO / engineering","change":"Approved temporary governed visual gap MVG-CUL-000012-001, batch-approved the low-risk profile and initiated C3 publication for Catalogue Batch C-001."}
  ]
}
