{
  "cultivarId": "CUL-000024",
  "programmeSlot": "024",
  "slug": "arakawa",
  "acceptedWorkingName": "Arakawa",
  "cultivarEpithet": "Arakawa",
  "taxonId": "TAX-APAL",
  "scientificName": "Acer palmatum ‘Arakawa’",
  "publicationClass": "catalogue-profile",
  "profileVersion": "1.0.0",
  "catalogueState": "review-ready",
  "riskLevel": "medium",
  "riskReasons": [
    "RHS accepts ‘Arakawa’ and records ‘Rough Bark Maple’ and ‘Rough Bark’ as synonyms, but those English labels can also be used descriptively in commerce.",
    "Rough corky bark develops with age and is not reliable on young plants; bark texture alone cannot authenticate the cultivar.",
    "Institutional size frameworks support a vigorous medium to larger tree and differ from compact nursery presentations."
  ],
  "duplicateCheck": {
    "reviewedBy": "Japanese Maple Atlas editorial stream",
    "reviewedAt": "2026-07-29T06:55:00Z",
    "comparedIds": ["RC-001","RC-002","RC-003","RC-004","RC-005","RC-006","RC-007","RC-008","RC-009","RC-010","CUL-000011","CUL-000012","CUL-000013","CUL-000014","CUL-000015","CUL-000016","CUL-000017","CUL-000018","CUL-000019","CUL-000020","CUL-000021","CUL-000022","CUL-000023","CUL-000025"],
    "comparedNames": ["Bloodgood","Seiryu","Sango-kaku","Crimson Queen","Aureum","Osakazuki","Butterfly","Shishi-gashira","Katsura","Mikawa-yatsubusa","Orange Dream","Koto-no-ito","Inaba-shidare","Beni-kawa","Trompenburg","Autumn Moon","Waterfall","Aoyagi","Shin-deshōjō","Red Dragon","Tamukeyama","Orangeola","Higasa-yama","Red Pygmy","Rough Bark Maple","Rough Bark","Arakawa-ukon","Acer palmatum ex ‘Arakawa’"],
    "result": "unique",
    "notes": "Compared with RC-003 ‘Sango-kaku’, CUL-000014 ‘Beni-kawa’, CUL-000018 ‘Aoyagi’ and other bark-interest maples. ‘Arakawa’ is distinct through its accepted name and age-dependent corky bark profile. ‘Arakawa-ukon’ is separately accepted; seedlings or ex-Arakawa material are not the cultivar. C0 resolves as unique."
  },
  "namingVariants": ["Rough Bark Maple","Rough Bark"],
  "identityNotes": "The Atlas uses ‘Arakawa’ as the accepted working name. RHS-recorded English names are retained as aliases but should not be applied generically to every rough-barked Japanese maple. ‘Arakawa-ukon’ is a separate accepted cultivar, and material labelled ex ‘Arakawa’ does not preserve clonal identity.",
  "content": {
    "summary": "A vigorous upright Japanese maple valued for rough corky bark that develops after several years, with small green five-lobed leaves turning golden yellow and orange in autumn.",
    "habit": "Vigorous upright deciduous small to medium tree, forming a bushy crown and becoming a substantial garden specimen with age.",
    "leafForm": "Small palmate green leaves, described by RHS as finely dissected and five-lobed within the palmatum group. Foliage is secondary to the age-dependent bark character.",
    "seasonal": {
      "spring": "Green leaves emerge on smooth young growth; rough bark should not be expected on very young plants.",
      "summer": "Foliage remains green while corky texture becomes more evident on older trunk and branches.",
      "autumn": "Leaves turn golden yellow and orange; exact balance varies by season and site."
    },
    "size": {
      "height": "4–7.6 m",
      "spread": "2.5–4 m",
      "qualifier": "RHS places the ultimate range at 4–8 m high and 2.5–4 m wide; JC Raulston lists 20–25 ft and measured one accession at 9 ft in 2015. Age and site materially affect both scale and bark development."
    },
    "cultivation": "Grow in moisture-retentive, well-drained soil in a sheltered position, in full sun to partial shade where moisture is reliable. Avoid excessive exposure and drought, which can cause leaf scorch.",
    "diagnostic": "Unlike coral- or green-stem cultivars, ‘Arakawa’ is defined by rough corky bark on older wood. Compare with ‘Arakawa-ukon’ and with seedlings sold as rough-bark maples; neither bark texture nor an English label alone proves clonal identity.",
    "confidence": "High confidence in accepted name, Acer palmatum placement, vigorous upright habit and age-dependent corky bark. Moderate confidence in alias scope, exact onset of bark expression and mature size.",
    "unresolvedIssue": "The English labels ‘Rough Bark Maple’ and ‘Rough Bark’ require context because they can function descriptively. The lean review does not establish a primary origin history or a universal age at which corking becomes conspicuous."
  },
  "sources": [
    {
      "id": "SRC-CUL-000024-01",
      "sourceClass": "institutional",
      "title": "Acer palmatum 'Arakawa' (P) — plant profile",
      "authority": "Royal Horticultural Society",
      "url": "https://www.rhs.org.uk/plants/50818/acer-palmatum-arakawa-p/details",
      "accessedAt": "2026-07-29T06:55:00Z",
      "locator": "Accepted-name profile: English synonyms, vigorous habit, age-dependent corky bark, leaf form, autumn colour, dimensions, cultivation and propagation.",
      "claimsSupported": ["accepted identity","recorded aliases","habit","bark","leaf form","seasonality","size","cultivation","propagation"],
      "limitations": "UK-centred profile; English aliases may be used descriptively elsewhere and the five-year bark statement is not a universal authentication threshold.",
      "confidence": "high"
    },
    {
      "id": "SRC-CUL-000024-02",
      "sourceClass": "institutional",
      "title": "Acer palmatum 'Arakawa' — living collection",
      "authority": "JC Raulston Arboretum",
      "url": "https://jcra.ncsu.edu/horticulture/our-plants/results-by-name-serial-number.php?serial=135052",
      "accessedAt": "2026-07-29T06:55:00Z",
      "locator": "Living accession xx0069; listed 20–25 ft, light-shade exposure and measured 9 ft on 25 August 2015.",
      "claimsSupported": ["living collection","supported taxon","habit context","size context","exposure","visual acquisition route"],
      "limitations": "One accession with limited descriptive detail; it does not establish synonymy or universal bark-development timing.",
      "confidence": "high"
    },
    {
      "id": "SRC-CUL-000024-03",
      "sourceClass": "institutional",
      "title": "Photographs of Acer palmatum 'Arakawa'",
      "authority": "JC Raulston Arboretum",
      "url": "https://jcra.ncsu.edu/resources/photographs/plants-results.php?serial=135052",
      "accessedAt": "2026-07-29T06:55:00Z",
      "locator": "Institutional photograph set covering foliage, dormant bark and autumn context across multiple dates and locations.",
      "claimsSupported": ["visual comparison","bark context","seasonal context","media acquisition route"],
      "limitations": "Photographs are source-identified and require separate rights and accession review; they are not sole evidence for accepted identity.",
      "confidence": "medium"
    }
  ],
  "media": {
    "state": "candidate-under-review",
    "primaryMediaId": null,
    "candidateMediaIds": [],
    "governedGap": null,
    "visualComplete": false,
    "identityBasis": "asserted"
  },
  "review": {
    "reviewedBy": "Japanese Maple Atlas editorial stream",
    "reviewedAt": "2026-07-29T06:55:00Z",
    "approvalState": "editorial-approved",
    "notes": "C0 targeted accepted-name and rough-bark alias review and C1 lean editorial/source review completed for Batch C-003. Profile remains non-public; no media approval, C2 or C3 is claimed."
  },
  "batchId": "C-003",
  "promotionStatus": "not-nominated",
  "referenceStandardId": null,
  "publishedAt": null,
  "revisionHistory": [
    {
      "version": "1.0.0",
      "date": "2026-07-29T06:55:00Z",
      "actor": "Japanese Maple Atlas editorial stream",
      "change": "Created the canonical non-public C-003 Catalogue Profile; completed C0 duplicate/naming review and C1 editorial/source review."
    }
  ]
}
