{
  "cultivarId": "CUL-000017",
  "programmeSlot": "017",
  "slug": "waterfall",
  "acceptedWorkingName": "Waterfall",
  "cultivarEpithet": "Waterfall",
  "taxonId": "TAX-APAL",
  "scientificName": "Acer palmatum ‘Waterfall’",
  "publicationClass": "catalogue-profile",
  "profileVersion": "1.1.0",
  "catalogueState": "review-ready",
  "riskLevel": "low",
  "riskReasons": [
    "RHS, Missouri Botanical Garden and a documented living collection consistently support the accepted name and Acer palmatum placement.",
    "The var. dissectum and Dissectum Group formulations describe horticultural placement rather than separate identities.",
    "Published size and autumn-colour emphasis vary modestly, but no material identity or synonym conflict remains."
  ],
  "duplicateCheck": {
    "reviewedBy": "Japanese Maple Atlas editorial stream",
    "reviewedAt": "2026-07-29T04:00:00Z",
    "comparedIds": [
      "RC-001",
      "RC-002",
      "RC-003",
      "RC-004",
      "RC-005",
      "RC-006",
      "RC-007",
      "RC-008",
      "RC-009",
      "RC-010",
      "CUL-000011",
      "CUL-000012",
      "CUL-000013",
      "CUL-000014",
      "CUL-000015",
      "CUL-000016",
      "CUL-000018",
      "CUL-000019",
      "CUL-000020",
      "CUL-000021",
      "CUL-000022",
      "CUL-000023",
      "CUL-000024",
      "CUL-000025"
    ],
    "comparedNames": [
      "Bloodgood",
      "Seiryu",
      "Sango-kaku",
      "Crimson Queen",
      "Aureum",
      "Osakazuki",
      "Butterfly",
      "Shishi-gashira",
      "Katsura",
      "Mikawa-yatsubusa",
      "Orange Dream",
      "Koto-no-ito",
      "Inaba-shidare",
      "Beni-kawa",
      "Trompenburg",
      "Autumn Moon",
      "Aoyagi",
      "Shin-deshōjō",
      "Red Dragon",
      "Tamukeyama",
      "Orangeola",
      "Higasa-yama",
      "Arakawa",
      "Red Pygmy",
      "Dissectum Viride Group",
      "Green laceleaf Japanese maple"
    ],
    "result": "unique",
    "notes": "Compared with RC-001–RC-010 and all other approved Catalogue assignments. ‘Waterfall’ is distinct from the generic Dissectum Viride Group and from unnamed green laceleaf maples; it is also distinct from upright RC-002 ‘Seiryu’ and the red dissectum profiles CUL-000013 and CUL-000020. C0 resolves as unique."
  },
  "namingVariants": [
    "Acer palmatum var. dissectum ‘Waterfall’",
    "Acer palmatum (Dissectum Group) ‘Waterfall’"
  ],
  "identityNotes": "The Atlas uses Acer palmatum ‘Waterfall’. Var. dissectum and Dissectum Group formulations are retained as horticultural placement and search variants, not separate cultivar identities. Generic ‘green laceleaf’ descriptions are insufficient to identify this cultivar.",
  "content": {
    "summary": "A green laceleaf Japanese maple forming a dense, cascading mound, with deeply dissected foliage that remains green through summer and develops a bright mixture of yellow, gold, orange and red in autumn.",
    "habit": "Pendulous, weeping shrub or small tree with cascading branches and a broad, mounded crown. It commonly spreads wider than it grows tall and can be trained to show more trunk.",
    "leafForm": "Fine, feathery dissectum foliage with narrow, deeply cut lobes divided to or near the leaf base. Missouri Botanical Garden describes seven to nine lobes and slightly longer leaves than generic green dissectum forms.",
    "seasonal": {
      "spring": "Fresh foliage emerges bright green; early growth can be vulnerable to late spring frost in exposed sites.",
      "summer": "Leaves remain bright to dark green, forming a dense lace-like canopy when moisture is adequate.",
      "autumn": "Foliage turns golden yellow with showy orange and red streaks; the balance of colours varies by site and season."
    },
    "size": {
      "height": "1.5–3 m",
      "spread": "2.5–3.7 m",
      "qualifier": "RHS gives 1.5–2.5 m high and 2.5–4 m wide; Missouri Botanical Garden gives 6–10 ft high and 8–12 ft wide. JC Raulston Arboretum records two plants measured at 7 ft in 2023."
    },
    "cultivation": "Grow in moisture-retentive, well-drained, preferably slightly acidic soil in a sheltered position. Part shade is dependable; full sun may be tolerated where soil stays reliably moist. Protect the fine foliage from drying wind and hot, dry exposure.",
    "diagnostic": "The combination of a broad cascading mound, green deeply dissected leaves and multicoloured yellow-orange-red autumn display supports comparison with ‘Waterfall’. It must not be inferred from any generic green laceleaf plant, and it is not the upright dissectum RC-002 ‘Seiryu’.",
    "confidence": "High confidence in accepted name, taxon, dissectum placement, cascading habit and broad seasonal sequence. Moderate confidence in ultimate dimensions and the precise autumn-colour balance because the institutional ranges and site observations differ.",
    "unresolvedIssue": "The lean review does not establish a single universal size ceiling or a quantitative leaf-length threshold separating ‘Waterfall’ from every green dissectum cultivar."
  },
  "sources": [
    {
      "id": "SRC-CUL-000017-01",
      "sourceClass": "institutional",
      "title": "Acer palmatum 'Waterfall' (D) — plant profile",
      "authority": "Royal Horticultural Society",
      "url": "https://www.rhs.org.uk/plants/74196/acer-palmatum-waterfall-d/details",
      "accessedAt": "2026-07-29T04:00:00Z",
      "locator": "Accepted-name profile: dissectum synonym, weeping habit, foliage, autumn colour, size, cultivation, hardiness and propagation.",
      "claimsSupported": [
        "accepted identity",
        "supported taxon",
        "dissectum placement",
        "habit",
        "leaf form",
        "seasonality",
        "size",
        "cultivation"
      ],
      "limitations": "UK-centred profile; general green laceleaf resemblance cannot authenticate an individual clone.",
      "confidence": "high"
    },
    {
      "id": "SRC-CUL-000017-02",
      "sourceClass": "institutional",
      "title": "Acer palmatum var. dissectum 'Waterfall' — Plant Finder",
      "authority": "Missouri Botanical Garden",
      "url": "https://www.missouribotanicalgarden.org/PlantFinder/PlantFinderDetails.aspx?hf=1&isprofile=0&taxonid=263157",
      "accessedAt": "2026-07-29T04:00:00Z",
      "locator": "Cultivar profile: accepted horticultural formulation, dimensions, cascading habit, leaf detail, seasonal colour, comparison with Dissectum Viride Group and culture.",
      "claimsSupported": [
        "identity",
        "habit",
        "leaf form",
        "seasonality",
        "size",
        "cultivation",
        "comparison"
      ],
      "limitations": "US garden framework; the var. dissectum formulation is horticultural and mature dimensions are contextual.",
      "confidence": "high"
    },
    {
      "id": "SRC-CUL-000017-03",
      "sourceClass": "institutional",
      "title": "Acer palmatum 'Waterfall' — living collection",
      "authority": "JC Raulston Arboretum",
      "url": "https://jcra.ncsu.edu/horticulture/our-plants/results-by-name-serial-number.php?serial=100196",
      "accessedAt": "2026-07-29T04:00:00Z",
      "locator": "Living-collection records for accessions xx0095 and 030005; both measured at 7 ft in 2023.",
      "claimsSupported": [
        "living collection",
        "supported name",
        "supported taxon",
        "measured height",
        "cultivated occurrence"
      ],
      "limitations": "Measurements concern two collection plants and do not define the cultivar's universal mature size or authenticate unrelated commercial material.",
      "confidence": "high"
    }
  ],
  "media": {
    "state": "approved-primary",
    "primaryMediaId": "MED-CUL-000017-001",
    "candidateMediaIds": [
      "MED-CUL-000017-002",
      "MED-CUL-000017-003"
    ],
    "governedGap": null,
    "visualComplete": true,
    "identityBasis": "asserted"
  },
  "review": {
    "reviewedBy": "Japanese Maple Atlas editorial stream",
    "reviewedAt": "2026-07-29T04:00:00Z",
    "approvalState": "editorial-approved",
    "notes": "C0 duplicate/naming review and C1 three-source review complete. Profile remains non-public; no media or C2 approval is implied. A lawful three-role Visual-First gallery has completed media review; the profile remains non-public and publication is not claimed."
  },
  "batchId": "C-002",
  "promotionStatus": "not-nominated",
  "referenceStandardId": null,
  "publishedAt": null,
  "revisionHistory": [
    {
      "version": "1.0.0",
      "date": "2026-07-29T04:00:00Z",
      "actor": "Japanese Maple Atlas editorial stream",
      "change": "Created the canonical non-public C-002 Catalogue Profile; completed C0 duplicate/naming review and C1 editorial/source review."
    },
    {
      "version": "1.1.0",
      "date": "2026-07-30T16:45:00Z",
      "actor": "Japanese Maple Atlas media / visual-assets stream",
      "change": "Added an approved lawful three-role Catalogue gallery with exact source preservation, item-level Creative Commons attribution, bounded identity qualification, privacy-treated deterministic derivatives and canonical primary linkage; publication state remains unchanged."
    }
  ]
}
